{
  "color_accuracy": "lc",
  "color_components": [
    {
      "coefficient": 1.0,
      "computed": true,
      "id": "flow:2,1",
      "index": 0,
      "kind": "lc-flow",
      "representative_id": "flow:2,1",
      "word": [
        2,
        1
      ]
    }
  ],
  "coverage": {
    "color": "complete",
    "color_kind": "physical-lc-flows",
    "helicities": "complete",
    "structural_zero_helicity_count": 6
  },
  "extensions": {
    "coherent_groups": [
      {
        "all_sector_weight": 1.0,
        "color_sector_id": 0,
        "color_word": [
          2,
          1
        ],
        "group_id": 0,
        "helicities": [
          1,
          -1,
          -1
        ],
        "helicity_weight": 1.0
      },
      {
        "all_sector_weight": 1.0,
        "color_sector_id": 0,
        "color_word": [
          2,
          1
        ],
        "group_id": 1,
        "helicities": [
          1,
          -1,
          0
        ],
        "helicity_weight": 1.0
      },
      {
        "all_sector_weight": 1.0,
        "color_sector_id": 0,
        "color_word": [
          2,
          1
        ],
        "group_id": 2,
        "helicities": [
          1,
          -1,
          1
        ],
        "helicity_weight": 1.0
      },
      {
        "all_sector_weight": 1.0,
        "color_sector_id": 0,
        "color_word": [
          2,
          1
        ],
        "group_id": 3,
        "helicities": [
          -1,
          1,
          -1
        ],
        "helicity_weight": 1.0
      },
      {
        "all_sector_weight": 1.0,
        "color_sector_id": 0,
        "color_word": [
          2,
          1
        ],
        "group_id": 4,
        "helicities": [
          -1,
          1,
          0
        ],
        "helicity_weight": 1.0
      },
      {
        "all_sector_weight": 1.0,
        "color_sector_id": 0,
        "color_word": [
          2,
          1
        ],
        "group_id": 5,
        "helicities": [
          -1,
          1,
          1
        ],
        "helicity_weight": 1.0
      }
    ],
    "color_contraction": null,
    "normalization": {
      "average_factor": 36,
      "color_accuracy": "lc",
      "color_factor": 3,
      "coupling_policy": "stage evaluators include local vertex couplings",
      "couplings_in_stage_evaluators": true,
      "electroweak_coupling_power": 1,
      "global_coupling_factor": 0.1896710455205285,
      "identical_factor": 1,
      "qcd_coupling_power": 0
    },
    "process_key": "d_dbar_to_z",
    "selected_source_helicities": {}
  },
  "external_particles": [
    {
      "index": 0,
      "label": 1,
      "momentum_components": [
        "E",
        "px",
        "py",
        "pz"
      ],
      "momentum_slot": 0,
      "particle": "d",
      "pdg": 1,
      "role": "initial"
    },
    {
      "index": 1,
      "label": 2,
      "momentum_components": [
        "E",
        "px",
        "py",
        "pz"
      ],
      "momentum_slot": 1,
      "particle": "d~",
      "pdg": -1,
      "role": "initial"
    },
    {
      "index": 2,
      "label": 3,
      "momentum_components": [
        "E",
        "px",
        "py",
        "pz"
      ],
      "momentum_slot": 2,
      "particle": "z",
      "pdg": 23,
      "role": "final"
    }
  ],
  "helicities": [
    {
      "coefficient": 0.0,
      "computed": false,
      "id": "h:-1,-1,-1",
      "index": 0,
      "representative_id": "h:-1,-1,-1",
      "structural_zero": true,
      "values": [
        -1,
        -1,
        -1
      ]
    },
    {
      "coefficient": 0.0,
      "computed": false,
      "id": "h:-1,-1,+0",
      "index": 1,
      "representative_id": "h:-1,-1,+0",
      "structural_zero": true,
      "values": [
        -1,
        -1,
        0
      ]
    },
    {
      "coefficient": 0.0,
      "computed": false,
      "id": "h:-1,-1,+1",
      "index": 2,
      "representative_id": "h:-1,-1,+1",
      "structural_zero": true,
      "values": [
        -1,
        -1,
        1
      ]
    },
    {
      "coefficient": 1.0,
      "computed": true,
      "id": "h:-1,+1,-1",
      "index": 3,
      "representative_id": "h:-1,+1,-1",
      "structural_zero": false,
      "values": [
        -1,
        1,
        -1
      ]
    },
    {
      "coefficient": 1.0,
      "computed": true,
      "id": "h:-1,+1,+0",
      "index": 4,
      "representative_id": "h:-1,+1,+0",
      "structural_zero": false,
      "values": [
        -1,
        1,
        0
      ]
    },
    {
      "coefficient": 1.0,
      "computed": true,
      "id": "h:-1,+1,+1",
      "index": 5,
      "representative_id": "h:-1,+1,+1",
      "structural_zero": false,
      "values": [
        -1,
        1,
        1
      ]
    },
    {
      "coefficient": 1.0,
      "computed": true,
      "id": "h:+1,-1,-1",
      "index": 6,
      "representative_id": "h:+1,-1,-1",
      "structural_zero": false,
      "values": [
        1,
        -1,
        -1
      ]
    },
    {
      "coefficient": 1.0,
      "computed": true,
      "id": "h:+1,-1,+0",
      "index": 7,
      "representative_id": "h:+1,-1,+0",
      "structural_zero": false,
      "values": [
        1,
        -1,
        0
      ]
    },
    {
      "coefficient": 1.0,
      "computed": true,
      "id": "h:+1,-1,+1",
      "index": 8,
      "representative_id": "h:+1,-1,+1",
      "structural_zero": false,
      "values": [
        1,
        -1,
        1
      ]
    },
    {
      "coefficient": 0.0,
      "computed": false,
      "id": "h:+1,+1,-1",
      "index": 9,
      "representative_id": "h:+1,+1,-1",
      "structural_zero": true,
      "values": [
        1,
        1,
        -1
      ]
    },
    {
      "coefficient": 0.0,
      "computed": false,
      "id": "h:+1,+1,+0",
      "index": 10,
      "representative_id": "h:+1,+1,+0",
      "structural_zero": true,
      "values": [
        1,
        1,
        0
      ]
    },
    {
      "coefficient": 0.0,
      "computed": false,
      "id": "h:+1,+1,+1",
      "index": 11,
      "representative_id": "h:+1,+1,+1",
      "structural_zero": true,
      "values": [
        1,
        1,
        1
      ]
    }
  ],
  "kind": "pyamplicol-resolved-physics",
  "model_parameters": [
    {
      "default_imaginary": 0.0,
      "default_real": 0.007546771114,
      "kind": "normalization",
      "mutable": true,
      "name": "normalization.alpha_ew"
    },
    {
      "default_imaginary": 0.0,
      "default_real": 0.118,
      "kind": "normalization",
      "mutable": true,
      "name": "normalization.alpha_s_me_check"
    },
    {
      "default_imaginary": 0.0,
      "default_real": 173.0,
      "kind": "mass",
      "mutable": true,
      "name": "particle.6.mass"
    },
    {
      "default_imaginary": 0.0,
      "default_real": 1.4915,
      "kind": "width",
      "mutable": true,
      "name": "particle.6.width"
    },
    {
      "default_imaginary": 0.0,
      "default_real": 91.188,
      "kind": "mass",
      "mutable": true,
      "name": "particle.23.mass"
    },
    {
      "default_imaginary": 0.0,
      "default_real": 2.441404,
      "kind": "width",
      "mutable": true,
      "name": "particle.23.width"
    },
    {
      "default_imaginary": 0.0,
      "default_real": 80.41900244575616,
      "kind": "mass",
      "mutable": true,
      "name": "particle.24.mass"
    },
    {
      "default_imaginary": 0.0,
      "default_real": 2.0476,
      "kind": "width",
      "mutable": true,
      "name": "particle.24.width"
    },
    {
      "default_imaginary": 0.0,
      "default_real": 125.0,
      "kind": "mass",
      "mutable": true,
      "name": "particle.25.mass"
    },
    {
      "default_imaginary": 0.0,
      "default_real": 0.006382339,
      "kind": "width",
      "mutable": true,
      "name": "particle.25.width"
    },
    {
      "default_imaginary": 0.0,
      "default_real": -1.0244420275940371,
      "kind": "coupling",
      "mutable": true,
      "name": "coupling.10.1_23_1.component_0"
    },
    {
      "default_imaginary": 0.0,
      "default_real": 0.17818666745287456,
      "kind": "coupling",
      "mutable": true,
      "name": "coupling.10.1_23_1.component_1"
    }
  ],
  "process": "d d~ > z",
  "process_id": "d_dbar_to_z",
  "reduction": {
    "groups": [
      {
        "id": "reduction:0",
        "physical_color_ids": [
          "flow:2,1"
        ],
        "physical_helicity_ids": [
          "h:+1,-1,-1"
        ],
        "representative_color_id": "flow:2,1",
        "representative_helicity_id": "h:+1,-1,-1"
      },
      {
        "id": "reduction:1",
        "physical_color_ids": [
          "flow:2,1"
        ],
        "physical_helicity_ids": [
          "h:+1,-1,+0"
        ],
        "representative_color_id": "flow:2,1",
        "representative_helicity_id": "h:+1,-1,+0"
      },
      {
        "id": "reduction:2",
        "physical_color_ids": [
          "flow:2,1"
        ],
        "physical_helicity_ids": [
          "h:+1,-1,+1"
        ],
        "representative_color_id": "flow:2,1",
        "representative_helicity_id": "h:+1,-1,+1"
      },
      {
        "id": "reduction:3",
        "physical_color_ids": [
          "flow:2,1"
        ],
        "physical_helicity_ids": [
          "h:-1,+1,-1"
        ],
        "representative_color_id": "flow:2,1",
        "representative_helicity_id": "h:-1,+1,-1"
      },
      {
        "id": "reduction:4",
        "physical_color_ids": [
          "flow:2,1"
        ],
        "physical_helicity_ids": [
          "h:-1,+1,+0"
        ],
        "representative_color_id": "flow:2,1",
        "representative_helicity_id": "h:-1,+1,+0"
      },
      {
        "id": "reduction:5",
        "physical_color_ids": [
          "flow:2,1"
        ],
        "physical_helicity_ids": [
          "h:-1,+1,+1"
        ],
        "representative_color_id": "flow:2,1",
        "representative_helicity_id": "h:-1,+1,+1"
      }
    ],